{
  "approval_policy": "single_human_with_ai_advisory",
  "batch_id": "blind-v2-annotation-batch-019",
  "case_ids": [
    "blind-v2-candidate-005347",
    "blind-v2-candidate-005351",
    "blind-v2-candidate-005352",
    "blind-v2-candidate-005354",
    "blind-v2-candidate-005355",
    "blind-v2-candidate-005356",
    "blind-v2-candidate-005362",
    "blind-v2-candidate-005364",
    "blind-v2-candidate-005365",
    "blind-v2-candidate-005370",
    "blind-v2-candidate-005396",
    "blind-v2-candidate-005398",
    "blind-v2-candidate-005400",
    "blind-v2-candidate-005402",
    "blind-v2-candidate-005409",
    "blind-v2-candidate-005412",
    "blind-v2-candidate-005415",
    "blind-v2-candidate-005417",
    "blind-v2-candidate-005420",
    "blind-v2-candidate-005423",
    "blind-v2-candidate-005424",
    "blind-v2-candidate-005436",
    "blind-v2-candidate-005441",
    "blind-v2-candidate-005442",
    "blind-v2-candidate-005443",
    "blind-v2-candidate-005449",
    "blind-v2-candidate-005450",
    "blind-v2-candidate-005453",
    "blind-v2-candidate-005488",
    "blind-v2-candidate-005492",
    "blind-v2-candidate-005494",
    "blind-v2-candidate-005496",
    "blind-v2-candidate-005497",
    "blind-v2-candidate-005500",
    "blind-v2-candidate-005503",
    "blind-v2-candidate-005505",
    "blind-v2-candidate-005506",
    "blind-v2-candidate-005509",
    "blind-v2-candidate-005515",
    "blind-v2-candidate-005516",
    "blind-v2-candidate-005517",
    "blind-v2-candidate-005518",
    "blind-v2-candidate-005519",
    "blind-v2-candidate-005520",
    "blind-v2-candidate-005521",
    "blind-v2-candidate-005522",
    "blind-v2-candidate-005525",
    "blind-v2-candidate-005527",
    "blind-v2-candidate-005534",
    "blind-v2-candidate-005537",
    "blind-v2-candidate-005540",
    "blind-v2-candidate-005543",
    "blind-v2-candidate-005546",
    "blind-v2-candidate-005549",
    "blind-v2-candidate-005568",
    "blind-v2-candidate-005575",
    "blind-v2-candidate-005578",
    "blind-v2-candidate-005580",
    "blind-v2-candidate-005581",
    "blind-v2-candidate-005582",
    "blind-v2-candidate-005584",
    "blind-v2-candidate-005588",
    "blind-v2-candidate-005589",
    "blind-v2-candidate-005591",
    "blind-v2-candidate-005594",
    "blind-v2-candidate-005595",
    "blind-v2-candidate-005600",
    "blind-v2-candidate-005601",
    "blind-v2-candidate-005604",
    "blind-v2-candidate-005605",
    "blind-v2-candidate-005610",
    "blind-v2-candidate-005614",
    "blind-v2-candidate-005615",
    "blind-v2-candidate-005617",
    "blind-v2-candidate-005619",
    "blind-v2-candidate-005620",
    "blind-v2-candidate-005621",
    "blind-v2-candidate-005622",
    "blind-v2-candidate-005624",
    "blind-v2-candidate-005628",
    "blind-v2-candidate-005629",
    "blind-v2-candidate-005631",
    "blind-v2-candidate-005661",
    "blind-v2-candidate-005670",
    "blind-v2-candidate-005671",
    "blind-v2-candidate-005673",
    "blind-v2-candidate-005675",
    "blind-v2-candidate-005676",
    "blind-v2-candidate-005681",
    "blind-v2-candidate-005682",
    "blind-v2-candidate-005683",
    "blind-v2-candidate-005684",
    "blind-v2-candidate-005685",
    "blind-v2-candidate-005686",
    "blind-v2-candidate-005687",
    "blind-v2-candidate-005688",
    "blind-v2-candidate-005689",
    "blind-v2-candidate-005691",
    "blind-v2-candidate-005695",
    "blind-v2-candidate-005696"
  ],
  "dataset": "blind-v2",
  "decision_date": "2026-07-31",
  "decision_method": "batch_human_confirmation",
  "inputs_sha256": "ddef836456ee29decf019dae981c1017b9728524c42808ae2d7c2c894299820a",
  "maintainer": "tim",
  "packet_sha256": "f5fec889d04c1cdc4599f81449fc4106fa76cef144d1bd42db29dacb0a3918c9",
  "status": "human_confirmed",
  "summary": "Maintainer confirmed the complete 100-case Codex synthesis after independent Agy advisory review.",
  "synthesis_sha256": "8d20296b48da375b3a452a7fd1163fb339bbe5f2aa06773d04b740c91ab6f1c7",
  "version": 1
}
